<?xml version="1.0"?>
<course:Kurs xmlns:xsi="http://www.w3.org/2001/XMLSchema-instance"
      xmlns:course="http://www.crowdcode.de/kurs"
      xsi:schemaLocation="http://www.crowdcode.de/kurs ../xsd/kurs-namespace.xsd">
    <Titel>Java Swing</Titel>
	<Modul Typ="notwendig">
		<Ueberschrift>Einleitung</Ueberschrift>
	</Modul>
	<Modul Typ="notwendig" >
		<Ueberschrift>Standardkomponenten</Ueberschrift>
	</Modul>
	<Modul Typ="optional">
		<Ueberschrift>Java2D</Ueberschrift>
	</Modul>
	<Jahre>2005 2006 2007 2008</Jahre>
</course:Kurs>
